name,price,inventoryQuantity,imageUrl,description,category
Wine - Champagne Brut Veuve,$68.94,67,/public/img/0.jpg,"Morbi ut odio. Cras mi pede, malesuada in, imperdiet et, commodo vulputate, justo. In blandit ultrices enim. Lorem ipsum dolor sit amet, consectetuer adipiscing elit. Proin interdum mauris non ligula pellentesque ultrices. Phasellus id sapien in sapien iaculis congue. Vivamus metus arcu, adipiscing molestie, hendrerit at, vulputate vitae, nisl. Aenean lectus. Pellentesque eget nunc. Donec quis orci eget orci vehicula condimentum.",adult
"Sparkling Wine - Rose, Freixenet",$82.71,31,/public/img/9.jpg,Suspendisse potenti.,adult
Juice - Apple Cider,$170.26,22,/public/img/6.jpg,Duis mattis egestas metus.,luxury
Bread - Pita,$65.79,48,/public/img/5.jpg,In hac habitasse platea dictumst.,adult
Stock - Fish,$38.54,74,/public/img/4.jpg,"In hac habitasse platea dictumst. Maecenas ut massa quis augue luctus tincidunt. Nulla mollis molestie lorem. Quisque ut erat. Curabitur gravida nisi at nibh. In hac habitasse platea dictumst. Aliquam augue quam, sollicitudin vitae, consectetuer eget, rutrum at, lorem. Integer tincidunt ante vel ipsum.",adult
Puree - Kiwi,$30.77,34,/public/img/3.jpg,"Etiam vel augue. Vestibulum rutrum rutrum neque. Aenean auctor gravida sem. Praesent id massa id nisl venenatis lacinia. Aenean sit amet justo. Morbi ut odio. Cras mi pede, malesuada in, imperdiet et, commodo vulputate, justo.",luxury
Soup - Campbells,$24.77,33,/public/img/4.jpg,Etiam vel augue. Vestibulum rutrum rutrum neque. Aenean auctor gravida sem. Praesent id massa id nisl venenatis lacinia. Aenean sit amet justo. Morbi ut odio.,luxury
Breadfruit,$101.05,39,/public/img/2.jpg,Aliquam quis turpis eget elit sodales scelerisque. Mauris sit amet eros. Suspendisse accumsan tortor quis turpis. Sed ante. Vivamus tortor. Duis mattis egestas metus. Aenean fermentum.,kids
"7up Diet, 355 Ml",$93.57,50,/public/img/9.jpg,Nulla ac enim.,kids
Juice - Ocean Spray Kiwi,$123.38,13,/public/img/3.jpg,"Nulla tempus. Vivamus in felis eu sapien cursus vestibulum. Proin eu mi. Nulla ac enim. In tempor, turpis nec euismod scelerisque, quam turpis adipiscing lorem, vitae mattis nibh ligula nec sem.",luxury
Horseradish Root,$13.16,27,/public/img/2.jpg,"Morbi sem mauris, laoreet ut, rhoncus aliquet, pulvinar sed, nisl. Nunc rhoncus dui vel sem.",adult
Beans - Kidney White,$132.37,31,/public/img/6.jpg,"Pellentesque ultrices mattis odio. Donec vitae nisi. Nam ultrices, libero non mattis pulvinar, nulla pede ullamcorper augue, a suscipit nulla elit ac nulla. Sed vel enim sit amet nunc viverra dapibus. Nulla suscipit ligula in lacus. Curabitur at ipsum ac tellus semper interdum. Mauris ullamcorper purus sit amet nulla.",luxury
Melon - Honey Dew,$143.17,32,/public/img/5.jpg,"Fusce lacus purus, aliquet at, feugiat non, pretium quis, lectus. Suspendisse potenti. In eleifend quam a odio. In hac habitasse platea dictumst. Maecenas ut massa quis augue luctus tincidunt. Nulla mollis molestie lorem. Quisque ut erat.",misc
Beer - True North Strong Ale,$115.09,88,/public/img/1.jpg,"Fusce posuere felis sed lacus. Morbi sem mauris, laoreet ut, rhoncus aliquet, pulvinar sed, nisl. Nunc rhoncus dui vel sem.",adult
Star Fruit,$124.76,69,/public/img/9.jpg,In hac habitasse platea dictumst. Etiam faucibus cursus urna. Ut tellus. Nulla ut erat id mauris vulputate elementum. Nullam varius. Nulla facilisi.,kids
Napkin - Beverage 1 Ply,$35.40,40,/public/img/6.jpg,Praesent blandit lacinia erat. Vestibulum sed magna at nunc commodo placerat.,luxury
"Coffee - Colombian, Portioned",$55.59,56,/public/img/2.jpg,"Nunc rhoncus dui vel sem. Sed sagittis. Nam congue, risus semper porta volutpat, quam pede lobortis ligula, sit amet eleifend pede libero quis orci. Nullam molestie nibh in lectus. Pellentesque at nulla. Suspendisse potenti.",misc
Sugar - White Packet,$154.67,47,/public/img/4.jpg,"Fusce lacus purus, aliquet at, feugiat non, pretium quis, lectus. Suspendisse potenti. In eleifend quam a odio. In hac habitasse platea dictumst. Maecenas ut massa quis augue luctus tincidunt. Nulla mollis molestie lorem. Quisque ut erat. Curabitur gravida nisi at nibh. In hac habitasse platea dictumst.",luxury
Cape Capensis - Fillet,$13.98,33,/public/img/4.jpg,"Donec diam neque, vestibulum eget, vulputate ut, ultrices vel, augue. Vestibulum ante ipsum primis in faucibus orci luctus et ultrices posuere cubilia Curae; Donec pharetra, magna vestibulum aliquet ultrices, erat tortor sollicitudin mi, sit amet lobortis sapien sapien non mi. Integer ac neque. Duis bibendum. Morbi non quam nec dui luctus rutrum. Nulla tellus. In sagittis dui vel nisl. Duis ac nibh.",misc
Liqueur - Melon,$14.65,71,/public/img/8.jpg,"In hac habitasse platea dictumst. Aliquam augue quam, sollicitudin vitae, consectetuer eget, rutrum at, lorem.",adult
Wine - Puligny Montrachet A.,$48.06,84,/public/img/9.jpg,"Aenean lectus. Pellentesque eget nunc. Donec quis orci eget orci vehicula condimentum. Curabitur in libero ut massa volutpat convallis. Morbi odio odio, elementum eu, interdum eu, tincidunt in, leo. Maecenas pulvinar lobortis est. Phasellus sit amet erat.",adult
"Pork - Butt, Boneless",$153.74,89,/public/img/3.jpg,Nullam molestie nibh in lectus.,luxury
Veal - Eye Of Round,$11.57,73,/public/img/7.jpg,"Aenean auctor gravida sem. Praesent id massa id nisl venenatis lacinia. Aenean sit amet justo. Morbi ut odio. Cras mi pede, malesuada in, imperdiet et, commodo vulputate, justo. In blandit ultrices enim.",adult
Pastry - Trippleberry Muffin - Mini,$78.90,7,/public/img/0.jpg,In hac habitasse platea dictumst.,adult
Mikes Hard Lemonade,$157.24,17,/public/img/0.jpg,"Vivamus metus arcu, adipiscing molestie, hendrerit at, vulputate vitae, nisl. Aenean lectus. Pellentesque eget nunc. Donec quis orci eget orci vehicula condimentum. Curabitur in libero ut massa volutpat convallis.",luxury
Truffle Cups - Brown,$198.64,8,/public/img/1.jpg,"Pellentesque ultrices mattis odio. Donec vitae nisi. Nam ultrices, libero non mattis pulvinar, nulla pede ullamcorper augue, a suscipit nulla elit ac nulla. Sed vel enim sit amet nunc viverra dapibus. Nulla suscipit ligula in lacus. Curabitur at ipsum ac tellus semper interdum.",kids
Tea - Herbal Orange Spice,$69.60,15,/public/img/4.jpg,"Sed sagittis. Nam congue, risus semper porta volutpat, quam pede lobortis ligula, sit amet eleifend pede libero quis orci. Nullam molestie nibh in lectus. Pellentesque at nulla. Suspendisse potenti. Cras in purus eu magna vulputate luctus. Cum sociis natoque penatibus et magnis dis parturient montes, nascetur ridiculus mus.",adult
Salmon - Canned,$191.71,46,/public/img/5.jpg,"In hac habitasse platea dictumst. Morbi vestibulum, velit id pretium iaculis, diam erat fermentum justo, nec condimentum neque sapien placerat ante.",kids
Beans - Yellow,$77.64,50,/public/img/5.jpg,"Donec vitae nisi. Nam ultrices, libero non mattis pulvinar, nulla pede ullamcorper augue, a suscipit nulla elit ac nulla. Sed vel enim sit amet nunc viverra dapibus. Nulla suscipit ligula in lacus. Curabitur at ipsum ac tellus semper interdum.",luxury
"Bread - Roll, Italian",$22.97,51,/public/img/6.jpg,"Aliquam quis turpis eget elit sodales scelerisque. Mauris sit amet eros. Suspendisse accumsan tortor quis turpis. Sed ante. Vivamus tortor. Duis mattis egestas metus. Aenean fermentum. Donec ut mauris eget massa tempor convallis. Nulla neque libero, convallis eget, eleifend luctus, ultricies eu, nibh. Quisque id justo sit amet sapien dignissim vestibulum.",adult
Beef Wellington,$32.83,7,/public/img/9.jpg,"Vivamus tortor. Duis mattis egestas metus. Aenean fermentum. Donec ut mauris eget massa tempor convallis. Nulla neque libero, convallis eget, eleifend luctus, ultricies eu, nibh. Quisque id justo sit amet sapien dignissim vestibulum. Vestibulum ante ipsum primis in faucibus orci luctus et ultrices posuere cubilia Curae; Nulla dapibus dolor vel est. Donec odio justo, sollicitudin ut, suscipit a, feugiat et, eros. Vestibulum ac est lacinia nisi venenatis tristique.",adult
Garlic - Peeled,$71.83,83,/public/img/4.jpg,Integer tincidunt ante vel ipsum.,kids
Rice - Long Grain,$34.20,62,/public/img/2.jpg,Phasellus in felis.,misc
"Capon - Breast, Double, Wing On",$54.41,43,/public/img/9.jpg,"Fusce lacus purus, aliquet at, feugiat non, pretium quis, lectus. Suspendisse potenti.",adult
Coffee - Ristretto Coffee Capsule,$151.12,4,/public/img/2.jpg,Duis bibendum. Morbi non quam nec dui luctus rutrum. Nulla tellus. In sagittis dui vel nisl. Duis ac nibh.,adult
Carbonated Water - Raspberry,$73.17,21,/public/img/7.jpg,"Proin eu mi. Nulla ac enim. In tempor, turpis nec euismod scelerisque, quam turpis adipiscing lorem, vitae mattis nibh ligula nec sem. Duis aliquam convallis nunc. Proin at turpis a pede posuere nonummy.",adult
Capon - Whole,$176.38,23,/public/img/9.jpg,"Sed vel enim sit amet nunc viverra dapibus. Nulla suscipit ligula in lacus. Curabitur at ipsum ac tellus semper interdum. Mauris ullamcorper purus sit amet nulla. Quisque arcu libero, rutrum ac, lobortis vel, dapibus at, diam. Nam tristique tortor eu pede.",misc
Wine - Conde De Valdemar,$163.70,96,/public/img/1.jpg,Etiam pretium iaculis justo. In hac habitasse platea dictumst. Etiam faucibus cursus urna. Ut tellus. Nulla ut erat id mauris vulputate elementum. Nullam varius. Nulla facilisi.,misc
Sprouts - Baby Pea Tendrils,$182.56,100,/public/img/3.jpg,"Vestibulum quam sapien, varius ut, blandit non, interdum in, ante. Vestibulum ante ipsum primis in faucibus orci luctus et ultrices posuere cubilia Curae; Duis faucibus accumsan odio. Curabitur convallis.",luxury
Pie Filling - Pumpkin,$107.76,15,/public/img/4.jpg,"Vestibulum ante ipsum primis in faucibus orci luctus et ultrices posuere cubilia Curae; Donec pharetra, magna vestibulum aliquet ultrices, erat tortor sollicitudin mi, sit amet lobortis sapien sapien non mi. Integer ac neque. Duis bibendum. Morbi non quam nec dui luctus rutrum.",luxury
Melon - Cantaloupe,$107.10,61,/public/img/6.jpg,"Vestibulum ante ipsum primis in faucibus orci luctus et ultrices posuere cubilia Curae; Nulla dapibus dolor vel est. Donec odio justo, sollicitudin ut, suscipit a, feugiat et, eros. Vestibulum ac est lacinia nisi venenatis tristique. Fusce congue, diam id ornare imperdiet, sapien urna pretium nisl, ut volutpat sapien arcu sed augue. Aliquam erat volutpat.",misc
Straws - Cocktale,$29.31,30,/public/img/7.jpg,"Nullam molestie nibh in lectus. Pellentesque at nulla. Suspendisse potenti. Cras in purus eu magna vulputate luctus. Cum sociis natoque penatibus et magnis dis parturient montes, nascetur ridiculus mus. Vivamus vestibulum sagittis sapien.",misc
Country Roll,$115.35,83,/public/img/6.jpg,Nulla tellus. In sagittis dui vel nisl. Duis ac nibh.,luxury
Bread Fig And Almond,$104.25,77,/public/img/7.jpg,"Lorem ipsum dolor sit amet, consectetuer adipiscing elit. Proin interdum mauris non ligula pellentesque ultrices.",kids
Lime Cordial - Roses,$88.68,92,/public/img/0.jpg,"Integer a nibh. In quis justo. Maecenas rhoncus aliquam lacus. Morbi quis tortor id nulla ultrices aliquet. Maecenas leo odio, condimentum id, luctus nec, molestie sed, justo. Pellentesque viverra pede ac diam. Cras pellentesque volutpat dui. Maecenas tristique, est et tempus semper, est quam pharetra magna, ac consequat metus sapien ut nunc. Vestibulum ante ipsum primis in faucibus orci luctus et ultrices posuere cubilia Curae; Mauris viverra diam vitae quam.",adult
Pate - Cognac,$63.37,53,/public/img/9.jpg,"Nam congue, risus semper porta volutpat, quam pede lobortis ligula, sit amet eleifend pede libero quis orci. Nullam molestie nibh in lectus. Pellentesque at nulla. Suspendisse potenti.",misc
Dill Weed - Dry,$20.40,12,/public/img/3.jpg,"Nulla neque libero, convallis eget, eleifend luctus, ultricies eu, nibh. Quisque id justo sit amet sapien dignissim vestibulum.",kids
Flounder - Fresh,$28.00,3,/public/img/8.jpg,"Cras mi pede, malesuada in, imperdiet et, commodo vulputate, justo. In blandit ultrices enim. Lorem ipsum dolor sit amet, consectetuer adipiscing elit. Proin interdum mauris non ligula pellentesque ultrices. Phasellus id sapien in sapien iaculis congue.",adult
Chocolate Bar - Coffee Crisp,$72.67,91,/public/img/2.jpg,"Phasellus id sapien in sapien iaculis congue. Vivamus metus arcu, adipiscing molestie, hendrerit at, vulputate vitae, nisl. Aenean lectus. Pellentesque eget nunc. Donec quis orci eget orci vehicula condimentum.",luxury
"Stock - Chicken, White",$167.98,16,/public/img/5.jpg,"Curabitur in libero ut massa volutpat convallis. Morbi odio odio, elementum eu, interdum eu, tincidunt in, leo. Maecenas pulvinar lobortis est. Phasellus sit amet erat. Nulla tempus. Vivamus in felis eu sapien cursus vestibulum.",misc
Sausage - Breakfast,$76.79,22,/public/img/3.jpg,"Duis bibendum, felis sed interdum venenatis, turpis enim blandit mi, in porttitor pede justo eu massa. Donec dapibus. Duis at velit eu est congue elementum. In hac habitasse platea dictumst. Morbi vestibulum, velit id pretium iaculis, diam erat fermentum justo, nec condimentum neque sapien placerat ante. Nulla justo.",kids
Fond - Chocolate,$93.83,26,/public/img/9.jpg,"Morbi vestibulum, velit id pretium iaculis, diam erat fermentum justo, nec condimentum neque sapien placerat ante. Nulla justo. Aliquam quis turpis eget elit sodales scelerisque. Mauris sit amet eros.",kids
Dehydrated Kelp Kombo,$186.59,33,/public/img/3.jpg,Mauris ullamcorper purus sit amet nulla.,adult
Shrimp - 31/40,$45.21,47,/public/img/6.jpg,Integer tincidunt ante vel ipsum. Praesent blandit lacinia erat.,misc
Bag - Regular Kraft 20 Lb,$145.14,91,/public/img/8.jpg,"In tempor, turpis nec euismod scelerisque, quam turpis adipiscing lorem, vitae mattis nibh ligula nec sem. Duis aliquam convallis nunc.",misc
Madeira,$71.89,50,/public/img/1.jpg,Quisque ut erat. Curabitur gravida nisi at nibh.,adult
Chocolate - Dark,$82.99,2,/public/img/9.jpg,"Duis at velit eu est congue elementum. In hac habitasse platea dictumst. Morbi vestibulum, velit id pretium iaculis, diam erat fermentum justo, nec condimentum neque sapien placerat ante. Nulla justo. Aliquam quis turpis eget elit sodales scelerisque.",luxury
Lamb Tenderloin Nz Fr,$72.63,82,/public/img/8.jpg,"Donec semper sapien a libero. Nam dui. Proin leo odio, porttitor id, consequat in, consequat ut, nulla.",adult
Vinegar - Red Wine,$195.06,44,/public/img/8.jpg,"Duis ac nibh. Fusce lacus purus, aliquet at, feugiat non, pretium quis, lectus. Suspendisse potenti. In eleifend quam a odio.",adult
Sprouts - Brussel,$51.62,70,/public/img/3.jpg,"Morbi non lectus. Aliquam sit amet diam in magna bibendum imperdiet. Nullam orci pede, venenatis non, sodales sed, tincidunt eu, felis. Fusce posuere felis sed lacus. Morbi sem mauris, laoreet ut, rhoncus aliquet, pulvinar sed, nisl. Nunc rhoncus dui vel sem.",adult
Ice Cream - Vanilla,$108.18,90,/public/img/1.jpg,Phasellus sit amet erat.,luxury
Vinegar - Balsamic,$140.91,49,/public/img/4.jpg,"Mauris sit amet eros. Suspendisse accumsan tortor quis turpis. Sed ante. Vivamus tortor. Duis mattis egestas metus. Aenean fermentum. Donec ut mauris eget massa tempor convallis. Nulla neque libero, convallis eget, eleifend luctus, ultricies eu, nibh. Quisque id justo sit amet sapien dignissim vestibulum. Vestibulum ante ipsum primis in faucibus orci luctus et ultrices posuere cubilia Curae; Nulla dapibus dolor vel est.",adult
Mints - Striped Red,$110.47,0,/public/img/1.jpg,Etiam pretium iaculis justo. In hac habitasse platea dictumst.,kids
Barramundi,$147.99,83,/public/img/1.jpg,Cras in purus eu magna vulputate luctus.,misc
Wine - Ruffino Chianti Classico,$89.08,18,/public/img/5.jpg,Suspendisse potenti. Cras in purus eu magna vulputate luctus.,luxury
V8 - Tropical Blend,$131.87,26,/public/img/2.jpg,"Pellentesque viverra pede ac diam. Cras pellentesque volutpat dui. Maecenas tristique, est et tempus semper, est quam pharetra magna, ac consequat metus sapien ut nunc. Vestibulum ante ipsum primis in faucibus orci luctus et ultrices posuere cubilia Curae; Mauris viverra diam vitae quam. Suspendisse potenti. Nullam porttitor lacus at turpis. Donec posuere metus vitae ipsum. Aliquam non mauris. Morbi non lectus.",misc
Mustard - Pommery,$91.89,55,/public/img/8.jpg,"Morbi non lectus. Aliquam sit amet diam in magna bibendum imperdiet. Nullam orci pede, venenatis non, sodales sed, tincidunt eu, felis.",adult
Cod - Fillets,$26.73,16,/public/img/0.jpg,"Quisque erat eros, viverra eget, congue eget, semper rutrum, nulla. Nunc purus. Phasellus in felis. Donec semper sapien a libero. Nam dui.",kids
Beef - Salted,$99.35,42,/public/img/7.jpg,"Proin eu mi. Nulla ac enim. In tempor, turpis nec euismod scelerisque, quam turpis adipiscing lorem, vitae mattis nibh ligula nec sem. Duis aliquam convallis nunc. Proin at turpis a pede posuere nonummy. Integer non velit.",luxury
Salmon - Fillets,$186.07,35,/public/img/5.jpg,"Quisque erat eros, viverra eget, congue eget, semper rutrum, nulla. Nunc purus. Phasellus in felis. Donec semper sapien a libero. Nam dui. Proin leo odio, porttitor id, consequat in, consequat ut, nulla.",kids
"Trout - Rainbow, Fresh",$62.53,35,/public/img/4.jpg,"Lorem ipsum dolor sit amet, consectetuer adipiscing elit. Proin risus. Praesent lectus. Vestibulum quam sapien, varius ut, blandit non, interdum in, ante. Vestibulum ante ipsum primis in faucibus orci luctus et ultrices posuere cubilia Curae; Duis faucibus accumsan odio. Curabitur convallis. Duis consequat dui nec nisi volutpat eleifend. Donec ut dolor. Morbi vel lectus in quam fringilla rhoncus.",kids
Truffle Cups - Brown,$42.24,16,/public/img/9.jpg,"Nullam molestie nibh in lectus. Pellentesque at nulla. Suspendisse potenti. Cras in purus eu magna vulputate luctus. Cum sociis natoque penatibus et magnis dis parturient montes, nascetur ridiculus mus. Vivamus vestibulum sagittis sapien. Cum sociis natoque penatibus et magnis dis parturient montes, nascetur ridiculus mus. Etiam vel augue. Vestibulum rutrum rutrum neque. Aenean auctor gravida sem.",adult
Apple - Granny Smith,$36.52,79,/public/img/9.jpg,Proin eu mi.,adult
"7up Diet, 355 Ml",$144.04,79,/public/img/0.jpg,Etiam faucibus cursus urna. Ut tellus. Nulla ut erat id mauris vulputate elementum. Nullam varius.,luxury
Sauce - Oyster,$154.33,90,/public/img/5.jpg,"Integer ac leo. Pellentesque ultrices mattis odio. Donec vitae nisi. Nam ultrices, libero non mattis pulvinar, nulla pede ullamcorper augue, a suscipit nulla elit ac nulla. Sed vel enim sit amet nunc viverra dapibus. Nulla suscipit ligula in lacus. Curabitur at ipsum ac tellus semper interdum. Mauris ullamcorper purus sit amet nulla. Quisque arcu libero, rutrum ac, lobortis vel, dapibus at, diam. Nam tristique tortor eu pede.",luxury
Egg - Salad Premix,$117.36,75,/public/img/2.jpg,Integer tincidunt ante vel ipsum. Praesent blandit lacinia erat. Vestibulum sed magna at nunc commodo placerat. Praesent blandit.,luxury
Chicken - Whole,$168.15,98,/public/img/7.jpg,"In hac habitasse platea dictumst. Aliquam augue quam, sollicitudin vitae, consectetuer eget, rutrum at, lorem. Integer tincidunt ante vel ipsum. Praesent blandit lacinia erat. Vestibulum sed magna at nunc commodo placerat. Praesent blandit.",misc
Lamb - Rack,$31.95,30,/public/img/3.jpg,"Duis at velit eu est congue elementum. In hac habitasse platea dictumst. Morbi vestibulum, velit id pretium iaculis, diam erat fermentum justo, nec condimentum neque sapien placerat ante. Nulla justo. Aliquam quis turpis eget elit sodales scelerisque. Mauris sit amet eros. Suspendisse accumsan tortor quis turpis. Sed ante. Vivamus tortor. Duis mattis egestas metus.",adult
Guava,$125.07,81,/public/img/5.jpg,"Fusce consequat. Nulla nisl. Nunc nisl. Duis bibendum, felis sed interdum venenatis, turpis enim blandit mi, in porttitor pede justo eu massa. Donec dapibus. Duis at velit eu est congue elementum.",adult
Wine - Ej Gallo Sierra Valley,$130.84,18,/public/img/5.jpg,"Cras non velit nec nisi vulputate nonummy. Maecenas tincidunt lacus at velit. Vivamus vel nulla eget eros elementum pellentesque. Quisque porta volutpat erat. Quisque erat eros, viverra eget, congue eget, semper rutrum, nulla. Nunc purus. Phasellus in felis. Donec semper sapien a libero.",adult
Cheese - St. Andre,$177.11,16,/public/img/2.jpg,Morbi non quam nec dui luctus rutrum. Nulla tellus.,adult
Calypso - Lemonade,$25.06,45,/public/img/8.jpg,"Duis consequat dui nec nisi volutpat eleifend. Donec ut dolor. Morbi vel lectus in quam fringilla rhoncus. Mauris enim leo, rhoncus sed, vestibulum sit amet, cursus id, turpis.",adult
Wine - Fat Bastard Merlot,$78.80,23,/public/img/2.jpg,"Morbi porttitor lorem id ligula. Suspendisse ornare consequat lectus. In est risus, auctor sed, tristique in, tempus sit amet, sem.",luxury
Straw - Regular,$108.27,31,/public/img/1.jpg,"Cum sociis natoque penatibus et magnis dis parturient montes, nascetur ridiculus mus. Etiam vel augue. Vestibulum rutrum rutrum neque. Aenean auctor gravida sem. Praesent id massa id nisl venenatis lacinia. Aenean sit amet justo. Morbi ut odio. Cras mi pede, malesuada in, imperdiet et, commodo vulputate, justo. In blandit ultrices enim.",adult
Beans - Fava Fresh,$184.82,86,/public/img/7.jpg,"Proin leo odio, porttitor id, consequat in, consequat ut, nulla. Sed accumsan felis. Ut at dolor quis odio consequat varius. Integer ac leo. Pellentesque ultrices mattis odio.",kids
Soup - Cream Of Broccoli,$199.10,9,/public/img/5.jpg,"Proin leo odio, porttitor id, consequat in, consequat ut, nulla. Sed accumsan felis. Ut at dolor quis odio consequat varius. Integer ac leo. Pellentesque ultrices mattis odio. Donec vitae nisi.",kids
Cookies - Assorted,$62.62,44,/public/img/2.jpg,Donec ut dolor. Morbi vel lectus in quam fringilla rhoncus.,misc
Gherkin - Sour,$13.18,34,/public/img/2.jpg,"Cras non velit nec nisi vulputate nonummy. Maecenas tincidunt lacus at velit. Vivamus vel nulla eget eros elementum pellentesque. Quisque porta volutpat erat. Quisque erat eros, viverra eget, congue eget, semper rutrum, nulla. Nunc purus. Phasellus in felis. Donec semper sapien a libero. Nam dui.",adult
"Pork - Loin, Bone - In",$153.81,43,/public/img/9.jpg,"Nullam porttitor lacus at turpis. Donec posuere metus vitae ipsum. Aliquam non mauris. Morbi non lectus. Aliquam sit amet diam in magna bibendum imperdiet. Nullam orci pede, venenatis non, sodales sed, tincidunt eu, felis.",adult
"Wine - Magnotta, White",$191.90,78,/public/img/6.jpg,"Vivamus tortor. Duis mattis egestas metus. Aenean fermentum. Donec ut mauris eget massa tempor convallis. Nulla neque libero, convallis eget, eleifend luctus, ultricies eu, nibh.",kids
"Beans - Black Bean, Preserved",$113.44,78,/public/img/9.jpg,In congue. Etiam justo. Etiam pretium iaculis justo. In hac habitasse platea dictumst. Etiam faucibus cursus urna. Ut tellus.,luxury
Assorted Desserts,$65.76,94,/public/img/6.jpg,"Etiam vel augue. Vestibulum rutrum rutrum neque. Aenean auctor gravida sem. Praesent id massa id nisl venenatis lacinia. Aenean sit amet justo. Morbi ut odio. Cras mi pede, malesuada in, imperdiet et, commodo vulputate, justo.",adult
Garlic - Peeled,$45.36,58,/public/img/5.jpg,"In est risus, auctor sed, tristique in, tempus sit amet, sem. Fusce consequat. Nulla nisl. Nunc nisl. Duis bibendum, felis sed interdum venenatis, turpis enim blandit mi, in porttitor pede justo eu massa. Donec dapibus. Duis at velit eu est congue elementum.",misc
Juice - Lemon,$169.14,81,/public/img/0.jpg,"Fusce lacus purus, aliquet at, feugiat non, pretium quis, lectus. Suspendisse potenti. In eleifend quam a odio. In hac habitasse platea dictumst.",luxury
Wine - Champagne Brut Veuve,$74.50,55,/public/img/9.jpg,Ut tellus. Nulla ut erat id mauris vulputate elementum.,luxury
"Crab - Claws, 26 - 30",$162.04,69,/public/img/8.jpg,"Cras in purus eu magna vulputate luctus. Cum sociis natoque penatibus et magnis dis parturient montes, nascetur ridiculus mus.",kids
Lotus Rootlets - Canned,$74.10,92,/public/img/8.jpg,In eleifend quam a odio. In hac habitasse platea dictumst. Maecenas ut massa quis augue luctus tincidunt. Nulla mollis molestie lorem.,luxury
Eel - Smoked,$23.85,22,/public/img/5.jpg,Curabitur gravida nisi at nibh. In hac habitasse platea dictumst.,luxury
Arizona - Plum Green Tea,$38.76,100,/public/img/1.jpg,Nunc nisl.,misc
Nantucket - Orange Mango Cktl,$85.84,85,/public/img/9.jpg,"Vivamus vel nulla eget eros elementum pellentesque. Quisque porta volutpat erat. Quisque erat eros, viverra eget, congue eget, semper rutrum, nulla. Nunc purus. Phasellus in felis. Donec semper sapien a libero. Nam dui. Proin leo odio, porttitor id, consequat in, consequat ut, nulla.",luxury
"Seedlings - Buckwheat, Organic",$57.76,33,/public/img/1.jpg,"Suspendisse potenti. Cras in purus eu magna vulputate luctus. Cum sociis natoque penatibus et magnis dis parturient montes, nascetur ridiculus mus. Vivamus vestibulum sagittis sapien. Cum sociis natoque penatibus et magnis dis parturient montes, nascetur ridiculus mus. Etiam vel augue. Vestibulum rutrum rutrum neque.",adult
Apple - Macintosh,$71.69,26,/public/img/8.jpg,Sed accumsan felis. Ut at dolor quis odio consequat varius.,luxury
Gooseberry,$45.28,61,/public/img/2.jpg,"Vestibulum quam sapien, varius ut, blandit non, interdum in, ante. Vestibulum ante ipsum primis in faucibus orci luctus et ultrices posuere cubilia Curae; Duis faucibus accumsan odio. Curabitur convallis. Duis consequat dui nec nisi volutpat eleifend.",kids
"Pasta - Shells, Medium, Dry",$145.48,9,/public/img/9.jpg,"Duis at velit eu est congue elementum. In hac habitasse platea dictumst. Morbi vestibulum, velit id pretium iaculis, diam erat fermentum justo, nec condimentum neque sapien placerat ante. Nulla justo. Aliquam quis turpis eget elit sodales scelerisque. Mauris sit amet eros. Suspendisse accumsan tortor quis turpis.",luxury
